{
  "$schema": "https://json-schema.org/draft/2020-12/schema",
  "$id": "https://ipermit.dev/schemas/2026-05-24/jurisdiction-record.schema.json",
  "title": "iPermit Jurisdiction Record",
  "description": "Canonical data shape of a single jurisdiction record. See docs/specs/jurisdiction-naming.md (T00-08). The jurisdiction_level enum is aligned with rule-object.schema.json so rule_object.jurisdiction_id can reference a jurisdiction_record.jurisdiction_id directly.",
  "type": "object",
  "additionalProperties": false,
  "required": [
    "jurisdiction_id",
    "canonical_name",
    "jurisdiction_level",
    "active_from"
  ],
  "properties": {
    "jurisdiction_id": {
      "type": "string",
      "description": "Permanent, opaque kebab-case slug. Hierarchical and self-describing. Never reused once issued. Grammar defined in jurisdiction-naming.md §3.",
      "pattern": "^[a-z]{2}(-[a-z]{2})?(-(federal|state|county|municipality|etj|utility-district|drainage-district|river-authority|special)-[a-z0-9]+(-[a-z0-9]+)*)?$",
      "minLength": 2,
      "maxLength": 120
    },
    "canonical_name": {
      "type": "string",
      "description": "Full official name. No abbreviations. Title Case. UTF-8. Diacritics preserved as-is. Apostrophes use U+2019 RIGHT SINGLE QUOTATION MARK.",
      "minLength": 1,
      "maxLength": 200
    },
    "jurisdiction_level": {
      "description": "Aligned with rule-object.schema.json jurisdiction_level enum.",
      "enum": [
        "federal",
        "state",
        "county",
        "municipality",
        "etj",
        "utility_district",
        "drainage_district",
        "river_authority",
        "special"
      ]
    },
    "parent_jurisdiction_id": {
      "type": ["string", "null"],
      "description": "ID of the immediate parent per the AGENTS.md jurisdiction hierarchy. Null only for federal jurisdictions. Multi-parent jurisdictions are not allowed — split into separate records.",
      "minLength": 2,
      "maxLength": 120
    },
    "aliases": {
      "type": "array",
      "description": "Alternate names observed in source documents. Each alias must declare its type so analysts can weigh matches during ingest (T02-06).",
      "items": {
        "type": "object",
        "additionalProperties": false,
        "required": ["value", "alias_type"],
        "properties": {
          "value": {
            "type": "string",
            "minLength": 1,
            "maxLength": 200,
            "description": "The alternate string itself, as it appears in the source."
          },
          "alias_type": {
            "enum": ["abbreviation", "historical", "colloquial", "misspelling"],
            "description": "Why this alias exists. Historical aliases SHOULD set date_from/date_to. Misspellings record observed errors so ingest can normalize them."
          },
          "source": {
            "type": "string",
            "description": "Where the alias was observed (URL, statute reference, intake form, etc.).",
            "minLength": 1
          },
          "date_from": {
            "type": "string",
            "format": "date",
            "description": "First date this alias was in use. Required pattern for historical aliases."
          },
          "date_to": {
            "type": "string",
            "format": "date",
            "description": "Last date this alias was in use. Null/absent means still current."
          },
          "notes": {
            "type": "string",
            "description": "Free-text analyst note (e.g. context of a misspelling)."
          }
        }
      },
      "uniqueItems": true
    },
    "fips": {
      "type": "object",
      "description": "U.S. Census Bureau FIPS identifiers. Required for federal, state, county. Optional for sub-county.",
      "additionalProperties": false,
      "properties": {
        "fips_state": {
          "type": "string",
          "pattern": "^[0-9]{2}$",
          "description": "Two-digit FIPS state code. Texas is '48'."
        },
        "fips_county": {
          "type": "string",
          "pattern": "^[0-9]{5}$",
          "description": "Five-digit FIPS county code (state + county). Travis County, TX is '48453'."
        },
        "fips_place": {
          "type": "string",
          "pattern": "^[0-9]{7}$",
          "description": "Seven-digit FIPS place code (state + place). Optional, used for municipalities."
        }
      }
    },
    "geometry_ref": {
      "type": ["string", "null"],
      "description": "Opaque pointer to a geometry record in the GIS store. Full GIS schema is T05-01's concern. String-only — no inline geometry.",
      "minLength": 1,
      "maxLength": 200
    },
    "active_from": {
      "type": "string",
      "format": "date",
      "description": "Date this jurisdiction came into legal existence (incorporation, county formation, district creation). For pre-1900 jurisdictions an analyst-attested approximate date is acceptable."
    },
    "active_to": {
      "type": ["string", "null"],
      "format": "date",
      "description": "Date this jurisdiction ceased to exist (dissolution, merger, split). Null means currently active."
    },
    "replaced_by": {
      "type": "array",
      "description": "Jurisdiction IDs that replace this record after dissolution/merger/split. Set together with active_to. See jurisdiction-naming.md §8.",
      "items": {
        "type": "string",
        "minLength": 2,
        "maxLength": 120
      },
      "uniqueItems": true
    },
    "replaced_from": {
      "type": "array",
      "description": "Jurisdiction IDs this record was carved or merged from. Set when this record is the result of a split or merger.",
      "items": {
        "type": "string",
        "minLength": 2,
        "maxLength": 120
      },
      "uniqueItems": true
    },
    "notes": {
      "type": "string",
      "description": "Free-text analyst notes. Not consumed by the rules engine."
    }
  },

  "allOf": [
    {
      "description": "Federal jurisdictions have no parent; all others must have one.",
      "if": {
        "properties": { "jurisdiction_level": { "const": "federal" } }
      },
      "then": {
        "properties": {
          "parent_jurisdiction_id": { "type": "null" }
        }
      },
      "else": {
        "required": ["parent_jurisdiction_id"],
        "properties": {
          "parent_jurisdiction_id": { "type": "string" }
        }
      }
    },
    {
      "description": "FIPS is required for federal, state, and county jurisdictions.",
      "if": {
        "properties": {
          "jurisdiction_level": { "enum": ["federal", "state", "county"] }
        }
      },
      "then": { "required": ["fips"] }
    },
    {
      "description": "County jurisdictions must carry both state and county FIPS.",
      "if": {
        "properties": { "jurisdiction_level": { "const": "county" } }
      },
      "then": {
        "properties": {
          "fips": { "required": ["fips_state", "fips_county"] }
        }
      }
    },
    {
      "description": "State jurisdictions must carry state FIPS.",
      "if": {
        "properties": { "jurisdiction_level": { "const": "state" } }
      },
      "then": {
        "properties": {
          "fips": { "required": ["fips_state"] }
        }
      }
    }
  ]
}
